,name,type,rating,number_of_ratings,final_price,original_price,discount
508,Ethics (Hindi) - Nitishastra with 1 Disc,"Hindi, Paperback, Sunil Agrahari",4.4,150,449,560,19
509,Giant Book Series Mermaid Colouring Book,"English, Paperback, unknown",4.6,536,58,199,70
510,Ncert Chemistry Part 1 And Part 2 For Class 12 Combo,"Paperback, NCERT",4.5,67,265,330,19
511,A Naturalist's Guide To The Reptiles Of India,"English, Paperback, Das Indraneil",4.3,30,317,499,36
512,Mathematics Class - 7,"Paperback, R S Aggarwal",4.3,381,195,270,27
513,Indian Army NER Soldier GD General Duty Recruitment Exa...,"Paperback, Hindi, Ram Singh Yadav, Yajvender Yadav",4.4,312,499,685,27
514,Neet Most Wanted Biology,"English, Paperback, Vyas Pooja",4.5,366,340,480,29
515,Bharat Ka Prachin Itihas,"Fine Paperback, Hindi, Ram Sharan Sharma",4.1,99,234,299,21
516,PROBLEMS IN GENERAL PHYSICS,"English, Paperback, Irodov I.E.",4.5,6717,120,130,7
517,Afcat (Flying Technical & Ground Duty Branch),"English, Paperback, unknown",4.4,2557,265,345,23
518,"Adhunik Bharat Ka Itihas By Vipin Chandra, Indian Polit...","Paperback, Hindi, Bipin Chandra and M laxmikanth",4.3,607,638,979,34
519,ESE 2021 Civil Engineering ESE Topicwise Objective Solv...,"English, Undefined, unknown",4.4,318,559,800,30
520,Master The NCERT for NEET Biology - Vol.1 2021,"English, Paperback, Sharma Sanjay",4.4,97,210,350,40
521,Set Of 3( Three )Classic Books,"Paperback, sapiens and stephens hawking",3.9,452,380,1228,69
522,Rrb Ntpc Guide 2019,"Hindi, Paperback, Experts",4.3,2992,179,265,32
523,Drishti Current Affairs Today Half Yearly 2020 Hindi,"HARD BOOK, Hindi, DRISHTI EXPERTS",4.0,101,146,200,27
524,Bhartiya Samvidhan And Rajyavyavastha,"Paperback, Hindi, mahesh kumar varnwal",4.5,473,275,399,31
525,Mathematics For Class -9 By R D Sharma For ( 2020-2021)...,"Paperback, R D SHARMA",4.5,373,411,445,7
526,IAS COMBO Indian Economy By Ramsh Singh 10th Edition An...,"Paperback, RAMESH SINGH, MAJID HUSSAIN",4.2,441,508,1250,59
527,Description The Richest Man In Babylon (Marathi),"Paperback, Marathi, Marathi Anuvad : Dr. Kamlesh Soman, George S. Clason",4.5,147,195,200,2
528,Understanding Physics Text Books For Jee Main & Advance...,"Paperback, DC PANDEY",4.4,80,1630,2080,21
529,"Srimad Bhagavad Gita (HINDI 2016 NEW Edition) (HINDI, H...","Hardcover, Hindi, A.C. Bhaktivendanta Swami Prabhupada",4.7,1525,190,480,60
530,"A Naturalist's Guide to the Trees & Shrubs of India, Pa...","English, Paperback, Sachdeva Pardeep",4.2,60,317,499,36
531,10 Last Years Solved Papers - CBSE Class 10 for 2019 Ex...,"English, Paperback, unknown",4.3,6455,399,499,20
532,Self Study Guide Clat 2020,"English, Paperback, unknown",4.3,1647,335,545,38
533,Chhaya Competitive Mathematics Challenger,"Paperback, Bengali, SUBIR DAS",4.5,96,370,440,15
534,Together with Social Science Study Material for Class 1...,"English, Paperback, Singh Namrata",4.4,1101,399,499,20
535,Mental Ability for Ntse & Olympiad Exams for Class 10 (...,"English, Paperback, Disha Experts",4.3,643,174,340,48
536,Mental Ability for Ntse & Olympiad Exams for Class 10 (...,"English, Paperback, Disha Experts",4.3,643,174,340,48
537,Nursery Writing Books For Kids (Combo Of 4 Books Viz. N...,"Paperback, Content Team at Target Publications",4.4,369,256,270,5
538,Ethics (Hindi) - Nitishastra with 1 Disc,"Hindi, Paperback, Sunil Agrahari",4.4,150,449,560,19
539,30 Practice Sets Indian Air Force Airman Group 'Y' (Non...,"English, Paperback, unknown",4.4,342,105,135,22
540,GATE 2021 Computer Science & Information Technology Bit...,"Paperback, By Subject Experts of the ACE Engineering Academy",4.5,69,225,300,25
541,How to Win Friends and Influence People - The First and...,"English, Paperback, Carnegie Dale",4.5,17036,139,199,30
542,How to Win Friends & Influence People,"English, Book, Carnegie Dale",4.5,5578,149,170,12
543,101 Animals Stories,"English, Paperback, unknown",4.3,545,152,200,24
544,A Naturalist's Guide To The Reptiles Of India,"English, Paperback, Das Indraneil",4.3,30,317,499,36
545,Saar Sangrah Ncert Class - Vi-Xii One Liner,"HARD BOOK, Hindi, MAHESH KUMAR BARNWAL",3.5,10,290,425,31
546,Twelfth Fail - TWELFTH FAIL with 1 Disc,"Hindi, Paperback, Pathak Anurag",4.6,5743,160,196,18
547,Bharat Ka Prachin Itihas,"Fine Paperback, Hindi, Ram Sharan Sharma",4.1,99,234,299,21
548,General Practice A Practical Manual With CD 5Ed (PB 201...,"Paperback, GHANSHYAM VAIDYA",3.5,4,638,715,10
549,Handbook of Chemistry,"English, Paperback, Arihant Experts",4.5,1197,189,295,35
550,The Essential Collection for Young Readers,"English, Paperback, Bond Ruskin",4.5,520,127,195,34
551,Delhi Police Constable 2019 - Delhi Police Constable Ma...,"English, Paperback, Arihant Experts",4.3,235,195,250,22
552,"Adhunik Bharat Ka Itihas By Vipin Chandra, Indian Polit...","Paperback, Hindi, Bipin Chandra and M laxmikanth",4.3,607,638,979,34
553,Bhartiya Samvidhan And Rajyavyavastha,"Paperback, Hindi, mahesh kumar varnwal",4.5,473,275,399,31
554,RSMSSB Rajasthan JE/AE Civil Engineering (Technical & N...,"Paperback, Hindi, yct",4.1,52,150,195,23
555,Verbal Reasoning (Hindi Edition),"Paperback, Hindi, Lucent's",4.4,283,271,360,24
556,Set Of 3( Three )Classic Books,"Paperback, sapiens and stephens hawking",3.9,452,380,1228,69
557,COMBO: CSIR-JRF-NET: Life Sciences Fundamentals And Pra...,"English, Paperback, Kumar Pranav",4.5,3755,639,940,32
558,The Origin of Species,"English, Paperback, Darwin Charles",4.5,2180,159,199,20
559,"Ncert Exemplar Problems-Solutions Physics,Chemistry,Mat...","English, Paperback, Arihant Expert",4.4,691,320,475,32
560,21st Shatabdi Mein Anthrashtriya Sambandh,"Hindi, Paperback, Pant Pushpesh",4.4,1640,200,240,16
561,IAS COMBO Indian Economy By Ramsh Singh 10th Edition An...,"Paperback, RAMESH SINGH, MAJID HUSSAIN",4.2,441,508,1250,59
562,Man Me Hai Vishwaas,"Marathi, Paperback, Patil Vishwas Nangre",4.5,1443,256,280,8
563,And Then There Were None,"English, Hardcover, Christie Agatha",4.6,5378,262,399,34
564,20 Practice Sets for IBPS Bank Clerk Preliminary Exam 2...,"Paperback, Disha Experts",4.3,25,116,225,48
565,"A Naturalist's Guide to the Trees & Shrubs of India, Pa...","English, Paperback, Sachdeva Pardeep",4.2,60,317,499,36
566,Cbse Chemistry Chapterwise Solved Papers Class 12 2019-...,"English, Paperback, unknown",4.5,4871,168,275,38
567,Bhartiya Nausena Senior Secondary (SSR),"Hindi, Paperback, Arihant Experts",4.2,861,179,260,31
568,Mathematics Class - 8,"Paperback, R S Aggarwal",4.3,227,210,280,25
569,Paryavaran Evem Paristhitiki Ncert Saar,"Paperback, Hindi, MAHESH KUMAR BARNWAL",4.4,134,210,345,39
570,UPPCS (Pre & Mains) Solved Question Paper 2020 (2012 'H...,"Hardcover, Hindi, SSGCP GROUP",4.3,51,170,255,33
571,Gate 2021 Previous Solved Papers Mechanical Engineering...,"Paperback, MADE EASY",4.5,99,679,875,22
572,Cbse All in One English Language & Literature Class 9 f...,"English, Paperback, Singh Gajendra",4.7,196,410,415,1
573,A Naturalist's Guide To The Reptiles Of India,"English, Paperback, Das Indraneil",4.3,30,317,499,36
574,Study Package Mathematics Nda & Na (National Defence Ac...,"English, Paperback, unknown",4.4,471,295,455,35
575,How to Win Friends and Influence People - The First and...,"English, Paperback, Carnegie Dale",4.5,17036,139,160,13
576,How to Win Friends and Influence People,"English, Paperback, Carnegie Dale",4.5,17036,96,150,36
577,How To Win Friends & Influence People - The First and S...,"English, Paperback, Dale Carnegie",4.4,107,118,150,21
578,"Adhunik Bharat Ka Itihas By Vipin Chandra, Indian Polit...","Paperback, Hindi, Bipin Chandra and M laxmikanth",4.3,607,638,979,34
579,10 Last Years Solved Papers,"English, Paperback, unknown",4.3,6455,425,599,29
580,Hindi-English Expert Translator Hindi Se English Transl...,"English, Paperback, Gupta S. C.",4.3,2175,130,175,25
581,FMGE Solutions for MCI Screening Examination,"English, Paperback, Kawthalkar Shirish M.",4.6,552,1645,1695,2
582,Set Of 3( Three )Classic Books,"Paperback, sapiens and stephens hawking",3.9,452,380,1228,69
583,Rbd Reet/rtet Shiksha Manovigyan,"Paperback, Hindi, DHEER SINGH DHABHAI",4.4,74,168,375,55
584,Magbook Indian History 2020,"English, Paperback, Arihant Experts",4.4,931,200,230,13
585,Kiran Bihar Police Forest Guard (Vanrakshi) Practice Wo...,"Paperback, Think Tank of Kiran Institute of Career Excellence (KICX)",4.1,19,211,225,6
586,"Daivathinte Charanmar, You Could be One","Malayalam, Undefined, unknown",4.6,3300,209,250,16
587,Airmen Group X (Technical Trades) Indian Air Force Exam...,"English, Paperback, Disha Experts",4.2,164,143,190,24
588,IAS COMBO Indian Economy By Ramsh Singh 10th Edition An...,"Paperback, RAMESH SINGH, MAJID HUSSAIN",4.2,441,508,1250,59
589,Key to Success Staff Nurses Recruitment Exam (12000+ So...,"English, Paperback, Abha Narwal, Honey Gangadharan",4.3,474,820,995,17
590,The Essentials of Forensic Medicine and Toxicology,"English, Paperback, Reddy K.S. Narayan",4.5,289,460,525,12
591,Cracking the Csat Paper-2,"Hindi, Paperback, unknown",4.3,517,479,745,35
592,Bharat Ka Prachin Itihas,"Fine Paperback, Hindi, Ram Sharan Sharma",4.1,99,234,299,21
593,Cracking the CSAT Paper-2,"English, Paperback, Arihant Experts",4.5,2949,745,850,12
594,Introductory Micro Economics For Class 11 By Sandeep Ga...,"Paperback, Sandeep Garg",4.4,26,288,335,14
595,Selina Concise Physics - Middle School For Class 7,"Paperback, Selina Pulbishers",4.5,55,215,295,27
596,Naveen Ankganit,"Paperback, RS Aggarwal",4.3,570,380,550,30
597,Introductory Microeconomics Class 11 for (2020-21) Firs...,"English, Paperback, Jain T.R.",4.5,153,355,360,1
598,"A Naturalist's Guide to the Trees & Shrubs of India, Pa...","English, Paperback, Sachdeva Pardeep",4.2,60,317,499,36
599,Jeev Vigyan Ncert,"Paperback, Hindi, MAHESH KUMAR BARNWAL",4.5,74,207,300,31
600,Prachin Bharat Ka Itihas Tatha Sanskriti,"Paperback, Hindi, K.C. Srivastava",4.2,270,418,625,33
601,INFORMATICS PRACTICES A TEXT BOOK FOR CLASS-XI,"Paperback, SUMITA ARORA",4.1,51,428,450,4
602,CDS Maths : Fastrack With Shortcut Tricks,"English, Paperback, DDE",4.5,82,341,552,38
603,Rrb Ntpc CBT Stage-1 2019 Practice Sets,"Hindi, Paperback, unknown",4.3,824,162,235,31
604,You Can Win,"English, Paperback, Khera Shiv",4.5,11410,250,365,31
605,"Bhartiya Nausena Mr & NMR Steward, Cook Avum Topass Bha...","Hindi, Paperback, unknown",4.3,1676,114,165,30
606,RRB NTPC 23 Solved Papers 2016-17 Stage I & II English ...,"English, Electronic book text, unknown",4.2,1057,162,240,32
607,Diary of a Young Girl,"English, Paperback, Frank Anne",4.5,1730,159,199,20
608,Ace Reasoning Ability For Banking and Insurance (Englis...,"English, Paperback, Adda247 Publications",4.3,541,299,500,40
609,A Naturalist's Guide To The Reptiles Of India,"English, Paperback, Das Indraneil",4.3,30,317,499,36
610,Indian Penal Code,"English, Paperback, Mishra S.N.",4.5,276,575,690,16
611,Wiley's J.D. Lee Concise Inorganic Chemistry for JEE (M...,"Paperback, Sudarsan Guha",4.4,85,700,899,22
612,101 Bedtime Stories,"English, Paperback, unknown",4.0,355,123,170,27
613,Police Constable Tatha Jail Sipahi Gujarati GPSC 2020,"Paperback, Gujarati, Jagadish Patel",4.3,27,290,320,9
614,Think and Grow Rich,"English, Paperback, Hill Napoleon",4.5,32855,159,199,20
615,"Adhunik Bharat Ka Itihas By Vipin Chandra, Indian Polit...","Paperback, Hindi, Bipin Chandra and M laxmikanth",4.3,607,638,979,34
616,SSC CHSL (10+2) Tier-1 Online Exam 2020 LDC/DEO/PSA Wit...,"Paperback, Arihant Publication",4.3,654,290,425,31
617,Jawahar Navodaya Vidyalaya Solved Papers 2021 For Class...,"English, Paperback, Arihant Experts",4.5,115,111,140,20
618,Sapiens,"Malayalam, Paperback, Harari Yuval Noah",4.6,121,365,499,26
619,Set Of 3( Three )Classic Books,"Paperback, sapiens and stephens hawking",3.9,452,380,1228,69
620,Speedy Railway Samanya Adhyan 1360 Sets Latest Edition ...,"Paperback, Hindi, SPEEDY PUBLICATION",3.9,193,164,280,41
621,New Simplified Physics A Reference Book For Class 11 By...,"Paperback, S L Arora",4.4,120,1030,1050,1
622,Ncert Exemplar Problems-Solutions Physics Class 12th - ...,"English, Paperback, Experts",4.4,3761,108,150,28
623,Shrimad Bhagwat Gita Mote Akshar Wali,"Hardcover, Hindi, Gita Press",4.5,109,170,450,62
624,Kiran's Ssc English Language Chapter Wise Solved Papers...,"Paperback, KIRAN INSTITUTE OF CAREER EXCELLENCE PVT.LTD. ( KICX )",4.3,248,519,650,20
625,IAS COMBO Indian Economy By Ramsh Singh 10th Edition An...,"Paperback, RAMESH SINGH, MAJID HUSSAIN",4.2,441,508,1250,59
626,My Journey,"Telugu, Paperback, Kalam A. P. J. Abdul",4.4,453,129,175,26
627,Arihant Mathematics Set Of 6 Books ( Trigonometry S L L...,"Paperback, S L LONEY, A I PRILPKO, HALL & KNIGHT, G N BURMAN, I A MARON I E IRODOV",4.4,168,610,900,32
628,Indian Army Military Nursing Services(MNS) BSC Nursing ...,"English, Paperback, A Panel of Author",4.2,1044,251,280,10
629,Bharat Ka Prachin Itihas,"Fine Paperback, Hindi, Ram Sharan Sharma",4.1,99,234,299,21
630,UPSC - Me Ani Tumhi,"Paperback, Marathi, Ansar Shaikh ( IAS )",4.5,975,211,250,15
631,25 Years' Chapterwise Solved Questions IAS Pre General ...,"English, Paperback, Arihant Experts",4.4,1395,284,399,28
632,The Diary Of a Young Girl,"English, Paperback, ANNE FRANK",4.5,4431,128,150,14
633,Kiran SSC 10+2 Delhi Police Constable CBE Practice Work...,"Paperback, Think Tank of Kiran Institute of Career Excellence (KICX)",4.4,16,239,275,13
634,English For General Competitions (Hindi)- Vol.1,"Paperback, Hindi, Neetu Singh",4.3,940,284,450,36
635,"A Naturalist's Guide to the Trees & Shrubs of India, Pa...","English, Paperback, Sachdeva Pardeep",4.2,60,317,499,36
636,NCERT 6th To 12th A Brief History Of India And Geograph...,"Paperback, Mahesh Kumar Barnwal",4.4,244,499,850,41
637,CDS Maths : Fastrack With Shortcut Tricks,"English, Paperback, DDE",4.5,82,341,552,38
638,Chanakya Neeti,"English, Paperback, Parashar Ashwini",4.3,1121,107,150,28
639,Problems In Chemistry For NEET/AIIMS ( Organic + Inorga...,"Paperback, NARENDRA AWASTHI, M S CHOUHAN, V K JAISWAL",4.5,44,1279,1376,7
640,Malgudi Days,"Marathi, Paperback, Narayan R. K.",4.5,26,285,300,5
641,Dark Horse,"Hindi, Paperback, Neelotpal Mrinal",4.5,183,120,150,20
642,Pathfinder Academy CSIR-JRF-NET Life Sciences Six Book ...,"English, Paperback, Pranav Kumar, Usha Mina",4.5,784,1539,3154,51
643,Solved Scanner CA Foundation (New Syllabus) Paper - 4 B...,"English, Shuchita Prakashan Private Limited, CA Amar Omar, CA Rasika Goenka",4.2,97,385,390,1
644,Comprehensive Guide to CDS OTA Exam,"Paperback, Disha Experts",4.3,20,354,550,35
645,UPSC - Me Ani Tumhi,"Paperback, Marathi, Ansar Shaikh ( IAS )",4.5,975,211,250,15
646,Understanding Physics for Jee Main and Advanced Mechani...,"English, Paperback, Pandey D.C.",4.6,2066,374,415,9
647,Giant Book Series Mermaid Colouring Book,"English, Paperback, unknown",4.6,536,58,199,70
648,Bharat Ka Samvidhan,"Hindi, Paperback, Ambedkar B.R.",4.3,2076,133,280,52
649,Snapshots English Supplementary Reader for Class - 11,"English, Paperback, unknown",4.4,668,33,35,5
650,Bharat Ki Aantarik Suraksha Aur Mukhya Chunautiyan,"Hindi, Paperback, Kumar Ashok",4.5,946,229,270,15
651,An Introduction to Assam General Knowledge,"English, Paperback, Baishya Sailen",4.5,149,234,325,28
652,Cbse All in One English Class 11,"English, Paperback, Singh Gajendra",4.6,353,375,450,16
653,The Feynman Lectures on Physics: Volume 3,"English, Paperback, Feynman Richard P.",4.7,1010,616,679,9
654,Data Structures Through C in Depth,"English, Paperback, Srivastava S. K.",4.4,1489,335,375,10
655,Very First Sight Words Sentences Level - 1,"English, Paperback, unknown",4.4,339,133,180,26
656,Verbal Reasoning (Hindi Edition),"Paperback, Hindi, Lucent's",4.4,283,271,360,24
657,Hindi Sulekh Pustak - Bhag - 1,"Hindi, Paperback, Dreamland Publications",4.4,236,90,100,10
658,Elementary Problems In Organic Chemistry Neet/aiims,"Paperback, M.S.CHAUHAN",4.3,182,448,480,6
659,"Human Geography, New Edition By Goh Cheng Leong (Englis...","Paperback, Goh Chengleong",4.2,4501,217,325,33
660,Essay ( Nibandh) for UPSC Civil Services Exam,"Hindi, Paperback, Nishant Jain IAS, Ganga Singh Rajpurohit IAS",4.5,269,225,275,18
661,The Monk Who Sold His Ferrari,"Kannada, Paperback, Sharma Robin S.",4.4,171,161,175,8
662,The Monk Who Sold His Ferrari,"Telugu, Paperback, Sharma Robin S.",4.4,240,174,190,8
663,Adhunik Bharat Ka Itihas,"Hindi, Paperback, Ahir Rajiv",4.3,5580,239,410,41
664,Drishti Samanya Gyan (GK),"Papeback, Hindi, Drishti Publications",4.4,305,210,230,8
665,Objective General English By SP Bakshi,"Paperback, Arihant Experts",4.4,41,235,280,16
666,Roads to Mussoorie,"English, Paperback, Bond Ruskin",4.5,1905,117,195,40
667,Quarterly Current Affairs April to June 2020 for Compet...,"English, Paperback, unknown",4.5,375,135,175,22
668,The Diary of a Young Girl,"English, Paperback, Anne Frank",4.5,4431,124,175,29
669,Spoken English Guru Daily Use English Sentence,"English, Paperback, unknown",4.3,3151,255,260,1
670,Science & Technology,"English, Paperback, Agrahari Ravi P.",4.5,192,450,595,24
671,SIMPLIFIED APPROACH TO INCOME TAX BCOM (PASS) 2021,"Paperback, DR. GIRISH AHUJA, DR. RAVI GUPTA",4.5,31,560,580,3
672,NCERT Computer Science Texbook For Class XI,"English, Paperback, NCERT",4.3,72,190,250,24
673,The 3 Mistakes of My Life,"English, Paperback, Bhagat Chetan",4.4,8618,164,250,34
674,Indian Economic Development For Class -12 By Sandeep Ga...,"Paperback, Sandeep Garg",4.3,115,238,245,2
675,12 Years' Solved Papers Cbse Aipmt & Neet 2020,"English, Paperback, Arihant Experts",4.4,2362,279,445,37
676,Modern Approach to Chemical Calculations,"English, Paperback, Mukerjee Ramendrachandra",4.5,107,535,570,6
677,COMPUTER SCIENCE WITH PYTHON TEXTBOOK FOR CLASS XI (201...,"English, Paperback, SUMITA ARORA",4.5,559,569,600,5
678,Arihant English Grammar & Composition For Competitive E...,"Paperback, S C GUPTA",4.7,12,285,375,24
679,Western Political Thought,"Paperback, O. P. Gauba",4.5,267,365,400,8
680,PSI STI ASO Tatyacha Thokla 27 Edition 2020 ( Released ...,"Paperback, Marathi, Eknath Patil",4.4,73,490,550,10
681,Mastering Numericals and Objectives of Physics for Clas...,"English, Paperback, Stalin Malhotra",4.5,144,318,375,15
682,Problems and Solutions in Organic Chemistry for Jee (Ma...,"English, Paperback, Mishra Surendra K.",4.6,123,495,599,17
683,Textbook of Pathology,"English, Hardcover, Mohan Harsh",4.4,1044,2195,2295,4
684,Mass Communication in India,"English, Paperback, Kumar Keval J.",4.4,952,240,299,19
685,A Handbook for Electrical Engineering,"English, Paperback, unknown",4.4,847,227,350,35
686,Oswaal Cbse Question Bank Class 12 Physics Book Chapter...,"English, Paperback, unknown",4.5,363,339,599,43
687,The Power,"English, CD-Audio, Byrne Rhonda",4.6,1545,24,30,20
688,Drishti Current Affairs Today September 2020,"HARD BOOK, Hindi, EXPERTS OF PANEL",4.7,53,130,180,27
689,Lucent’s General Science,"Paperback, Hindi, Sanjeev Kumar & Neeraj Chandra Chaudhary",4.8,10,185,195,5
690,RRB NTPC Solved Papers,"English, Paperback, Arihant Experts",4.3,3131,208,225,7
691,Oxford Student Atlas - Bharat Sanskaran ( Hindi Version...,"Hindi, Paperback, Oxford",4.4,2084,252,395,36
692,Simplified Chalu Ghadamodi 15th Ank ( 1 March 2020 To 3...,"Paperback, Marathi, Divya Mahale, Balaji Surane",4.5,41,124,175,29
693,GATE 2021 Mechanical Practice Booklet 1116 Expected Que...,"Paperback, By Subject Experts of the ACE Engineering Academy",4.6,67,337,450,25
694,Nursing Research and Statistics,"English, Paperback, Suresh Sharma",4.4,477,469,545,13
695,Indian Army Military Nursing Service B.Sc (Nursing) 202...,"English, Paperback, unknown",4.3,484,164,195,15
696,Bihar Ek Parichay Vastunisth,"Paperback, Hindi, Imtiyaz Hussain & Rajneesh Kumar",4.2,302,135,145,6
697,Samanya Gyan,"Paperback, Hindi, RITESH KUMAR",4.2,69,197,240,17
698,Ncert Class 10th Sst,"Paperback, NCERT",4.4,164,310,375,17
699,Civil Engineering 1st Edition,"English, Paperback, Khurmi R. S.",4.3,7595,417,650,35
700,B.Sc. Nursing Samanya Nursing Evum Midwifery (GNM) Pras...,"Paperback, Hindi, Arihant Publication India Limited",3.9,40,383,495,22
701,Speedy Railway Samanya Adhyan 1390 Sets,"Paperback, Hindi, SPEEDY",3.4,7,180,280,35
702,SSB (Sashastra Seema Bal) Constable Driver Recruitment ...,"Hindi, Paperback, RPH Editorial Board",4.6,10,134,160,16
703,"Think and Grow Rich - Magic Formula for Success, Wealth...","English, Paperback, Hill Napoleon",4.5,32849,150,195,23
704,My First Book of Patterns Numbers 1 to 20 - Write and P...,"English, Paperback, unknown",4.5,1082,101,140,27
705,Bihar Samanya Gyan,"Paperback, Hindi, SUDHIR LAL",4.3,10,298,390,23
706,Sochiye Aur Ameer Baniye,"Hindi, Paperback, Hill Napoleon",4.4,1935,155,175,11
707,Complete Companion for Iim Indore Ipm(Integrated Progra...,"English, Paperback, unknown",4.4,268,560,699,19
708,151 Essays 2012,"English, Paperback, Dr. Gupta S. C.",4.1,359,231,335,31
709,"English PPC (Passage, PQRS & Cloze Test) SSC, CDS, CPO,...","Paperback, Christopher Phoenix",4.3,69,347,396,12
710,A Naturalist's Guide To The Reptiles Of India,"English, Paperback, Das Indraneil",4.3,30,317,499,36
711,Oswaal CBSE Question Bank Chapterwise & Topicwise Solve...,"Paperback, Oswaal Editorial Board",3.9,8,456,599,23
712,Research Methodology,"English, Paperback, Kothari C.R.",4.4,578,399,560,28
713,Solved Scanner CA Foundation (New Syllabus) Paper -3 Bu...,"English, Shuchita Prakashan Private Limited, CA Amar Omar, CA Rasika Goenka",4.3,106,530,539,1
714,Marathi Grammar-Pari Purn Marathi Vyakaran,"Paperback, Marathi, Balasaheb Shinde",4.3,264,240,300,20
715,"Adhunik Bharat Ka Itihas By Vipin Chandra, Indian Polit...","Paperback, Hindi, Bipin Chandra and M laxmikanth",4.3,607,638,979,34
716,Sri Vishnu Puran With Premium Wooden Book Stand,"Hardcover, Hindi, Gita Press",4.3,72,350,599,41
717,Samanya Gyan ( General Knowledge ) For Competitive Exam,"HARDBOOK, Hindi, Ankit Bhati",4.4,204,135,175,22
718,GATE 2021 Computer Science & Information Technology Bit...,"Paperback, By Subject Experts of the ACE Engineering Academy",4.4,64,210,280,25
719,Set Of 3( Three )Classic Books,"Paperback, sapiens and stephens hawking",3.9,452,380,1228,69
720,25 Practice Sets Indian Air Force Airman Group 'X' (Tec...,"English, Paperback, Arihant Experts",4.5,277,115,155,25
721,Differential Calculus for Jee Main and Advanced,"English, Paperback, Agarwal Amit M.",4.6,2210,425,480,11
722,"Don't Lose Your Mind, Lose Your Weight","English, Paperback, Diwekar Rujuta",4.3,5452,196,199,1
723,Mathematics Textbook For Class 9th,"Paperback, Ncert",4.2,362,142,150,5
724,Banking Awareness,"English, Paperback, unknown",4.2,5203,118,160,26
725,IAS COMBO Indian Economy By Ramsh Singh 10th Edition An...,"Paperback, RAMESH SINGH, MAJID HUSSAIN",4.2,441,508,1250,59
726,Solved Papers CAPF Assistant Commandant 2020,"Hindi, Paperback, Arihant Experts",4.2,219,215,235,8
727,General Knowledge 2021 (NCERT) IN ENGLISH 544 PAGES,"PAPERBOOK, TARUN GOYAL",4.4,237,210,240,12
728,The Orient BlackSwan Atlas for Competitive Exams,"English, Paperback, unknown",4.4,2041,244,250,2
729,Bharat Ka Prachin Itihas,"Fine Paperback, Hindi, Ram Sharan Sharma",4.1,99,234,299,21
730,"Wiley's Solomons, Fryhle & Snyder Organic Chemistry for...","English, Undefined, unknown",4.4,162,695,919,24
731,TIME Study Material 2020-2021 For CAT And MBA Exam,"Paperback, T.I.M.E",4.3,17,1989,2999,33
732,"Mathematics RD Sharma Class 8th (Paperback, RD Sharma)","Paperback, R D Sharma",4.6,248,410,415,1
733,Advanced Problems in ORGANIC CHEMISTRY FOR JEE WITH Sol...,"Paperback, M.S. Chouhan",4.3,128,510,600,15
734,NCERT Words And Expressions English Workbook Class 10,"Hardcover, NCERT",4.3,129,128,150,14
735,"A Naturalist's Guide to the Trees & Shrubs of India, Pa...","English, Paperback, Sachdeva Pardeep",4.2,60,317,499,36
736,Jeetna Hai to Jid Karo,"Hindi, Undefined, Hundiwalan S.",4.4,3799,130,135,3
737,Together with Science Study Material for Class 10,"Paperback, Mr RP Manchanda, Ms Archita Bhattacharya, Mr SK Goel",4.0,9,437,499,12
738,Objective Electrical Technology,"Paperback, v.k mehta",4.4,288,498,875,43
739,CDS Maths : Fastrack With Shortcut Tricks,"English, Paperback, DDE",4.5,82,341,552,38
740,Accountancy Class- XII (Part-A) - Vol. I Paperback â ...,"English, Paperback, D.K. Goel (Author), Rajesh Goel (Author), Shelly Goel (Author)",4.5,235,470,749,37
741,Ghai Essential Pediatrics,"English, Hardcover, unknown",4.5,334,499,960,48
742,MLA Handbook for Writers Of Research Papers 7th  Editio...,"English, MLA",4.4,529,158,195,18
743,GEOMORPHOLOGY,"English, INDIGO BOOKS, SAVINDRA SINGH",4.3,178,425,575,26
744,Engineering Thermodynamics,"English, Paperback, unknown",4.5,1029,561,660,15
745,10 Years Solved Papers,"English, Paperback, unknown",4.5,5351,699,950,26
746,10 Years Solved Papers,"English, Paperback, unknown",4.5,5351,645,992,34
747,Rukmini Railway Vastunisth Samanya Adhyayan Previous Ye...,"Paperback, Hindi, Rukmini Prakashan",4.3,177,128,130,1
748,Ethics (Hindi) - Nitishastra with 1 Disc,"Hindi, Paperback, Sunil Agrahari",4.4,150,449,560,19
749,Lines and Curves (Pattern Writing) Part 1,"English, Paperback, Sadhna",4.3,308,76,100,24
750,"NCERT Physics Textbook Part - 1 And 2 , Chemistry Textb...","Paperback, NCERT",3.8,140,639,880,27
751,Veterinary Medicine,"Paperback, Hindi, Dr. M.L. Parihar",4.1,231,175,200,12
752,GATE-2021: Electrical Engg. Prev. Yr Solved Papers,"MADE EASY Publications, MADE EASY Editorial Board",4.4,103,609,875,30
753,Algebra for Jee (Advanced) - For JEE (Advanced) 3 Editi...,"English, Paperback, Tewani G.",4.5,99,655,899,27
754,A Naturalist's Guide To The Reptiles Of India,"English, Paperback, Das Indraneil",4.3,30,317,499,36
755,Self Study Guide For LLB Entrance Examination 2020,"English, Paperback, Arihant Experts",4.3,1089,311,420,25
756,Shakespeare's The Tempest (A.W. Verity Edition) Text Wi...,"Paperback, P.S. Latika, Xavier Pinto",4.3,90,190,300,36
757,Bharat Ka Prachin Itihas,"Fine Paperback, Hindi, Ram Sharan Sharma",4.1,99,234,299,21
