,name,type,rating,number_of_ratings,final_price,original_price,discount
254,Premier Home Science Human Ecology And Family Sciences ...,"Paperback, Pushpa Balyan",4.8,35,272,289,5
255,Jawahar Navodaya Vidyalaya Class 9 2021,"English, Paperback, unknown",4.4,145,228,295,22
256,Concepts Of Physics Vol I & II With Solutions Of Both T...,"PAPERBAGE, H C VERMA",4.5,544,1063,1300,18
257,Objective Ncert at Your Fingertips for Neet-Aiims - Che...,"English, Paperback, unknown",4.5,5495,529,750,29
258,Sharda Ankganit By S.D Yadav,"Paperback, Hindi, Dr. S. D. Yadav",4.4,419,312,450,30
259,An Introduction to Political Theory,"English, Paperback, Gauba O.P.",4.4,730,395,500,21
260,Pariksha Manthan Lakshya 4 2020 In Hindi,"Paperback, Hindi, Anil Agrawal",5.0,4,149,180,17
261,Quantitative Aptitude,"English, Paperback, Aggarwal R. S.",4.2,30691,330,635,48
262,"THE LEXICON For Ethics, Integrity & Aptitude","Paperback, CHRONICLE",4.4,246,280,395,29
263,ACCOUNTANCY CLASS-XI,"English, Paperback, SHELLY GOEL, DK GOEL, RAJESH GOEL",4.6,107,680,690,1
264,Blossom Story Book For Kids In English | 3 To 4 Year Ol...,"Paperback, Content Team at Target Publications",4.3,132,66,70,5
265,Mathematics for Jee Main,"English, Paperback, Tewani G.",4.4,1020,725,965,24
266,Ncrt Physics Part 1+2 Taxbook For Class 11th New,"Paperback, NCERT",4.4,84,214,260,17
267,Who Will Cry When You Die?,"Marathi, Paperback, Sharma Robin S.",4.4,124,177,185,4
268,The Secret,"English, CD-Audio, Byrne Rhonda",4.4,14227,16,17,5
269,Oswaal CBSE Question Bank Chapterwise & Topicwise Solve...,"Paperback, Oswaal Editorial Board",5.0,6,395,599,34
270,Bharat Ka Bhugol: Civil Seva/Rajya Seva Ki Prarambhik E...,"Hindi, Paperback, Hussain Majid",4.5,3362,444,565,21
271,The Diary of A Young Girl,"English, Paperback, Anne Frank",4.5,4431,121,135,10
272,The Diary of a Young Girl,"English, Paperback, Anne Frank",4.5,4431,200,240,16
273,Mastering Essay & Answer Writing for UPSC Civil Service...,"English, Undefined, Singh Awdhesh",4.5,451,118,160,26
274,Purvavlokan General Science 2020 (20121-C),"Paperback, SSGCP GROUP",4.5,113,280,345,18
275,THE DIARY OF A YOUNG GIRL,"English, Paperback, ANNE FRANK",4.5,4431,125,150,16
276,General Knowledge 2020,"English, Paperback, Arihant Experts",4.3,9480,149,185,19
277,A Complete Study Pacakage for Mca Entrances,"English, Paperback, Agarwal Amitm",4.4,1104,673,825,18
278,REVIEW OF PHARMACY 10ED (RO),"English, Paperback, PRABHAKAR",4.2,380,539,717,24
279,Writing Fun-Set of 4 Books,"English, Paperback, unknown",4.4,3691,106,299,64
280,The Book Thief,"English, Paperback, Zusak Markus",4.6,4147,380,499,23
281,Kiran SSC Mathematics Chapterwise & Typewise Solved Pap...,"Paperback, Kiran Prakashan",4.3,822,517,700,26
282,Pediatric Nursing (As per INC Syllabus),"English, Paperback, Datta Parul",4.5,331,573,625,8
283,Objective Ncert at Your Fingertips for Neet-Aiims - Phy...,"English, Paperback, unknown",4.5,2826,476,700,32
284,Mathematics Class - 6,"Paperback, R S Aggarwal",4.4,341,195,260,25
285,Ross & Wilson Anatomy and Physiology in Health and Illn...,"English, Paperback, BSc PhD FHEA Waugh Anne",4.5,875,901,1160,22
286,Eduteria Current Affairs,"Paperback, Hindi, PRAVEEN KUMAR",4.4,1384,71,95,25
287,Atomic Habits : The Life-Changing Million Copy Bestsell...,"Paperback, James Clear",4.3,21,193,599,67
288,My First 100 Animals & Birds,"English, Hardcover, unknown",4.4,1701,94,299,68
289,18 Afcat Year-Wise (2020 - 11) Solved Papers,"English, Paperback, unknown",4.4,358,114,190,40
290,English For General Competitions Revised Edition 2020 V...,"Paperback, Hindi, Neetu Singh",4.2,510,240,550,56
291,Pitman Shorthand Instructor And Key 1st  Edition,"English, Paperback, Issac Pitman",4.4,2622,97,169,42
292,Park's Textbook of Preventive and Social Medicine 25th ...,"English, Paperback, K. Park",4.0,532,831,1400,40
293,AADITYA Vastunisth Samanya Hindi 2020 For All Competiti...,"HARD BOOK, Hindi, PAWAN KUMAR TIWARI",4.5,114,188,225,16
294,Bhagavad Gita - Iskcon,"Bengali, Paperback, Prabhupada A. C. Bhaktivedanta Swami",4.7,1390,245,750,67
295,Get Success In SSB Interviews,"English, Paperback, Arihant Experts",4.4,2318,180,250,28
296,Total English For Class - 9 According To The Latest ICS...,"Paperback, Xavier Pinto, Pamela Pinto",4.5,107,265,295,10
297,CDS Maths : Fastrack With Shortcut Tricks,"English, Paperback, DDE",4.5,82,341,552,38
298,Public Administration,"English, Paperback, Laxmikanth M.",4.4,2890,650,800,18
299,GATE-2021 Electronics & Communication Engineering Previ...,"Paperback, By Subject Experts of the ACE Engineering Academy",4.6,45,675,900,25
300,Everyday Vocabulary More Than 6100 Words,"English, Paperback, Gupta Kumkum",4.2,8380,58,75,22
301,Arihant Jee Mains 3-Books Set (Mathematics + Physics + ...,"Paperback, ARIHANT PRAKASHAN",4.3,531,537,855,37
302,Ncert Chemistry Class 11 Pack Of 2 Book ( Part 1 And 2 ...,"Paperback, NCERT",4.1,1541,208,335,37
303,Set Of 3( Three )Classic Books,"Paperback, sapiens and stephens hawking",3.9,452,380,1228,69
304,Bihar Samagrah Pre Revised 2019 (Hindi ),"Paperback, Hindi, KBC EXPERT",4.4,52,210,270,22
305,Dental Pulse 14th Edition,"Paperback, K. Satheesh Kumar Reddy",4.4,11,4379,5250,16
306,Police Bharti Sampurna Margadarshak 2020 : Sahyadr Acad...,"Paperback, Marathi, Mr. Umesh Rupanwar",4.3,92,350,650,46
307,History Of Modern India By Bipan Chandra ( New Edition ...,"Paperback, Bipan Chandra",4.5,6,297,425,30
308,Concept Of Physics - Part 1 & 2 2019 - 2020 Session (Se...,"Paperback, HC VERMA",4.5,123,699,870,19
309,Objective Ncert at Your Fingertips for Neet-Aiims - Che...,"English, Paperback, unknown",4.5,5495,519,700,25
310,"D,Pharma 1st Year (6 Books In Bilingual English Hindi B...","Hardbook, Others, Hemant Bhardwaj, Avnesh Kumar, Dr. Neeraj Gupta, Dr. Akhil Sharma, Desh Deepak Pandey, Raj Kumar TIwari, Neeraj Kumar",4.3,169,1070,1300,17
311,My First Book of Patterns Numbers 1 to 20,"English, Paperback, unknown",4.5,1082,46,199,76
312,C Programming Language 2nd  Edition,"English, Paperback, Brian W. Kernighan, Dennis M. Ritchie",4.5,2071,294,440,33
313,"Pharmacology for Medical Graduates, 4th Edition","English, Paperback, Dr. Shanbhag Tara",4.5,469,783,895,12
314,Combo Objective Physics For Neet Volume - 1 & 2,"Paperback, DC PANDEY",4.5,11,1165,1398,16
315,Ignited Minds - Unleashing the Power Within India,"English, Paperback, A P J Abdul Kalam",4.5,708,160,199,19
316,General Knowledge 2021,"English, Paperback, Pandey Manohar",4.4,9049,25,30,16
317,Rukmini Railway Mathematics (2700) Previous Year Solved...,"Paperback, Hindi, Rukmini Prakashan",4.3,165,140,160,12
318,IAS Mains Chapterwise Solved Papers General Studies 202...,"English, Paperback, Mittal Siddharth",4.5,2607,277,450,38
319,"Physics Part 1 & 2, Chemistry Part -1 & 2 And Biology T...","Paperback, NCERT",4.2,1528,650,840,22
320,Analytical Reasoning,"English, Paperback, Pandey M K",4.2,3954,279,350,20
321,SSC Samanya Adhyayan 1999-2020,"Paperback, Hindi, Rakesh Yadav",4.5,59,409,500,18
322,How to Prepare for Quantitative Aptitude for the CAT,"English, Paperback, Sharma Arun",4.5,10967,725,865,16
323,Agriculture at a glance 21st ed,"English, Paperback, Sharma R K",4.5,375,452,495,8
324,Nift Exam Full Package,"Paperback, LearnX.co.in",4.0,124,495,795,37
325,Moment & Beehive English Ncert Book Class 9th (Set Of 2...,"Paperback, Ncert",4.3,780,118,120,1
326,Indian Army NER Soldier GD General Duty Recruitment Exa...,"Paperback, Hindi, Ramsinh Yadav",4.3,33,118,135,12
327,"Oswaal CBSE Question Bank Class 10 Science, Social Scie...","Paperback, Oswaal Editorial Board",4.7,103,919,1201,23
328,The Story of My Life,"English, Paperback, Keller H",4.1,156,73,95,23
329,GATE-2021 Mechanical Engineering Previous GATE Question...,"Paperback, By Subject Experts of the ACE Engineering Academy",4.3,89,615,820,25
330,Lucent General Knowledge Hindi 2018 Edition,"Paperback, Hindi, S K SINGH",4.4,1781,140,160,12
331,A Naturalist's Guide To The Reptiles Of India,"English, Paperback, Das Indraneil",4.3,30,317,499,36
332,Giant Book Series Princess Colouring Book,"English, Paperback, unknown",4.6,771,58,199,70
333,Arihant General Intelligence And Reasoning Test,"Paperback, Hindi, R K JHA",4.3,249,139,150,7
334,Indian Navy Secondary SSR Guide 2019,"English, Paperback, unknown",4.3,2230,186,265,29
335,A Modern Approach to Verbal & Non-Verbal Reasoning,"English, Paperback, Aggarwal R. S.",4.4,21037,500,825,39
336,"Adhunik Bharat Ka Itihas By Vipin Chandra, Indian Polit...","Paperback, Hindi, Bipin Chandra and M laxmikanth",4.3,607,638,979,34
337,Rapidex English for Hindi Speakers,"English, Mixed media product, unknown",4.3,6819,220,235,6
338,Student Atlas For India,"HARDBOOK, ROBINA",4.5,460,259,339,23
339,"Rogi Swayam Chikitsak, Focuses On Ayurveda, Daily Habit...","Paperback, Hindi, NA",4.4,1206,149,159,6
340,Set Of 3( Three )Classic Books,"Paperback, sapiens and stephens hawking",3.9,452,380,1228,69
341,A TEXTBOOK OF FORENSIC PHARMACY (RO),"English, Paperback, JAIN",4.3,133,215,330,34
342,Ikigai,"Marathi, Paperback, GarciA HeCtor",4.4,165,237,250,5
343,32 Year's Neet-Aiipmt Chapterwise Solution Physics & Ch...,"Paperback, MTG",4.4,282,395,600,34
344,Judo Jodo Aur Jeeto (Network Marketing) H Hindi,"Hindi, Paperback, Patni Ujjaval",4.4,931,184,250,26
345,IAS COMBO Indian Economy By Ramsh Singh 10th Edition An...,"Paperback, RAMESH SINGH, MAJID HUSSAIN",4.2,441,508,1250,59
346,A Handbook for Letter Writing,"English, Paperback, Gupta S.C.",4.3,3039,100,150,33
347,Arihant Delhi Police Constable 2020 ( Buy Form Trueman ...,"Paperback, Hindi, ARIHANT TEAM",4.3,82,187,275,32
348,SSC English 2019 For General Competitions(Volume - 1),"Paperback, NEETU SINGH",4.4,1897,300,490,38
349,Bharat Ka Prachin Itihas,"Fine Paperback, Hindi, Ram Sharan Sharma",4.1,99,234,299,21
350,Complete NEET Guide Chemistry,"English, Paperback, unknown",4.4,3000,615,750,18
351,The Girl in Room 105,"Bengali, Paperback, Bhagat Chetan",4.3,40,171,250,31
352,Computer Knowledge for SBI/ IBPS Clerk/ PO/ RRB/ RBI/ S...,"English, Paperback, Shikha Agarwal",4.2,1186,114,200,43
353,Self Study Package LLB Pravesh Pariksha 2020,"Hindi, Paperback, Arihant Experts",4.2,309,355,420,15
354,Problems in Physical Chemistry for Jee (Main & Advanced...,"English, Paperback, Avasthi Narendra",4.5,1610,415,518,19
355,"A Naturalist's Guide to the Trees & Shrubs of India, Pa...","English, Paperback, Sachdeva Pardeep",4.2,60,317,499,36
356,After We Collided,"English, Paperback, Todd Anna",4.7,316,248,399,37
357,Chemistry Part 1 Class 12th,"Paperback, ncert",4.2,367,170,206,17
358,IIT JAM Mathematics Solved Papers and Practice sets 202...,"English, Paperback, Neha Tyagi",4.6,35,223,270,17
359,CDS Maths : Fastrack With Shortcut Tricks,"English, Paperback, DDE",4.5,82,341,552,38
360,151 Essays,"English, Paperback, Gupta S. C.",4.4,3368,201,335,40
361,General Knowledge 2019 ( Science Physics Chemistry Biol...,"hardbook, Hindi, Sunil Kumar Singh",4.4,746,143,210,31
362,Creative Crayons Super Pack,"English, Paperback, unknown",4.6,848,166,499,66
363,Cbse All in One Science Class 9 for 2021 Exam,"English, Paperback, Sharma Heena",4.7,283,324,450,28
364,GATE 2021 Electrical Engineering Previous GATE Question...,"Paperback, By Subject Experts of the ACE Engineering Academy",4.4,86,540,720,25
365,Objective Ncert at Your Fingertips for Neet-Aiims - Phy...,"English, Paperback, unknown",4.5,2826,529,750,29
366,Mathematics MCQ (Multiple-Choice-Question Bank),"English, Paperback, Gupta Asit Das",4.3,781,412,582,29
367,Rajan D.el.ed. Second Semester Question Bank 7 Books,"Paperback, Hindi, RAJAN",4.6,16,183,220,16
368,Ethics (Hindi) - Nitishastra with 1 Disc,"Hindi, Paperback, Sunil Agrahari",4.4,150,449,560,19
369,AFCAT the first step,"English, Paperback, DDE",4.3,425,312,560,44
370,THE HOLY BIBLE HINDI (O.V.) Re- Edited COMPACT SIZE CON...,"IMITATION LEATHER, Hindi, THE WORD OF GOD",4.6,136,339,450,24
371,CBSE All In One Mathematics Class 10 for 2021 Exam,"English, Paperback, Kumar Prem",4.6,386,352,490,28
372,7 Years Upsc IAS/ Ips Mains English (Compulsory) Year-W...,"English, Paperback, unknown",4.3,327,85,100,15
373,A Naturalist's Guide To The Reptiles Of India,"English, Paperback, Das Indraneil",4.3,30,317,499,36
374,Governance in India,"English, McGrawhill, Laxmikanth M.",4.5,5297,467,550,15
375,Crown Samanya Gyan,"Paperback, Hindi, Ritesh Kumar",4.3,518,210,240,12
376,Crown Samanya Gyan,"Paperback, Hindi, Ritesh Kumar",4.3,518,203,240,15
377,Bharat Ka Prachin Itihas,"Fine Paperback, Hindi, Ram Sharan Sharma",4.1,99,234,299,21
378,PROBLEMS IN PHYSICAL CHEMISTRY FOR JEE,"Paperback, Narendra Avasthi",4.4,261,401,518,22
379,"Lexicon for Ethics, Integrity & Aptitude for IAS Genera...","English, Paperback, Kumar Niraj",4.4,1493,225,395,43
380,Cracking the Csat Paper-2,"English, Paperback, Arihant Experts",4.5,2949,595,850,30
381,One Night at the Call Centre,"English, Paperback, Bhagat Chetan",4.4,4527,166,250,33
382,"Adhunik Bharat Ka Itihas By Vipin Chandra, Indian Polit...","Paperback, Hindi, Bipin Chandra and M laxmikanth",4.3,607,638,979,34
383,Madhya Pradesh Ek Samagra Adhyyan,"Paperback, Hindi, Mahesh Kumar Burnwal",4.4,172,290,350,17
384,Ancient and Medieval India,"English, Paperback, Dahiya Poonam Dalal",4.6,11155,535,550,2
385,"Arihant NCERT Exemplar .A Set Of 3 Books Physics,Chemis...","Paperback, Arihant Experts",4.3,323,333,475,29
386,Set Of 3( Three )Classic Books,"Paperback, sapiens and stephens hawking",3.9,452,380,1228,69
387,Nobel 262 Mega Police Bharati Prashnapatrika Sancha 201...,"Paperback, Marathi, Prof. K.K. Bhutekar",4.4,237,230,275,16
388,Skills in Mathematics,"English, Paperback, unknown",4.5,1724,180,225,20
389,Cbse Chapterwise Solved Papers 2019-2020 Physics Class ...,"English, Paperback, unknown",4.5,5326,168,300,44
390,RRB 2020 Maths (General & Advance) Chapter-Wise & Type-...,"Paperback, Hindi, yct",4.2,34,312,395,21
391,Problems in General Physics,"English, Paperback, IE, Irodov",4.0,3,159,199,20
392,IAS COMBO Indian Economy By Ramsh Singh 10th Edition An...,"Paperback, RAMESH SINGH, MAJID HUSSAIN",4.2,441,508,1250,59
393,Errorless Physics For NEET 2020 ( Set Of 2 Volume),"Paperback, late shri mohan lal",4.4,302,800,1590,49
394,Think And Grow Rich ( Hindi ),"Paperback, Hindi, NAPOLEON HILL",4.3,1061,160,175,8
395,Mathematics For Class - 7 ,"Paperback, NCERT EXPERTS",4.2,352,45,50,10
396,"A Naturalist's Guide to the Trees & Shrubs of India, Pa...","English, Paperback, Sachdeva Pardeep",4.2,60,317,499,36
397,Essential English Grammar,"English, Paperback, Murphy",4.3,5683,168,225,25
398,The Secret,"Bengali, Paperback, Byrne Rhonda",4.4,829,261,450,42
399,Indian Forestry A Breakthrough Approach To Forest Servi...,"PAPERPACK, K. MANIKANDAN",4.5,476,420,430,2
400,A Brief History Of Modern India Spectrum,"Paperback, rajiv ahir",4.3,1073,250,395,36
401,Delhi Police Constable Male/Female Computer Based Test ...,"Paperback, Arihant publication india limited",4.4,107,188,285,34
402,Indian Army Mer Technical,"English, Paperback, Ahluwalia R.D.",4.3,619,148,195,24
403,Ethics (Hindi) - Nitishastra with 1 Disc,"Hindi, Paperback, Sunil Agrahari",4.4,150,449,560,19
404,RSMSSB Rajasthan Junior Engineer 2020 Non Tech All Prev...,"Paperback, Hindi, Doctor Rajiv",4.3,272,205,248,17
405,Dietetics,"English, Paperback, Srilakshmi B.",4.4,481,480,760,36
406,"A Handbook on Civil Engineering - IES, GATE, PSUs & Oth...","English, Paperback, Made Easy",4.3,1935,259,350,26
407,Biology Tax Book For Class 11th,"Paperback, NCERT",4.2,140,183,230,20
408,"A Thousand Splendid Suns (English, Paperback)","Paperback, Genric Author",4.2,157,190,499,61
409,A Naturalist's Guide To The Reptiles Of India,"English, Paperback, Das Indraneil",4.3,30,317,499,36
410,Sampurna Ganit - Clupyta Aani Sutre,"Paperback, Marathi, Pandharinath Rane",4.2,196,229,275,16
411,Bharat Ka Prachin Itihas,"Fine Paperback, Hindi, Ram Sharan Sharma",4.1,99,234,299,21
412,The Power of Your Subconscious Mind,"English, Hardcover, Murphy Joseph",4.4,5155,489,679,27
413,The Constitution Of India As Amended By The Jammu And K...,"Paperback, Universal",4.6,249,185,220,15
414,Competitive Book of Agriculture,"English, Paperback, Sunda Nem Raj",4.4,1092,250,350,28
415,Adhunik Bharat Ka Itihas,"Hindi, Paperback, Ahir Rajiv",4.3,5580,268,400,33
416,Fundamental Of Physical Geography Class 11,"Paperback, Ncert",4.2,812,108,110,1
417,"Adhunik Bharat Ka Itihas By Vipin Chandra, Indian Polit...","Paperback, Hindi, Bipin Chandra and M laxmikanth",4.3,607,638,979,34
418,Upsc Civil Services Examination Previous 12 Years ( 200...,"Paperback, Drishti Publications",4.5,377,305,375,18
419,Set Of 3( Three )Classic Books,"Paperback, sapiens and stephens hawking",3.9,452,380,1228,69
420,The Power of Your Subconscious Mind,"English, Paperback, Murphy Joseph",4.4,5155,1419,1989,28
421,The Power of Your Subconscious Mind,"English, Hardcover, Murphy Joseph",4.4,5155,1669,2339,28
422,Purvavlokan Samanya Bhugol 2020 (2013-C),"Hindi, Paperback, SSGCP GROUP",4.5,331,282,312,9
423,"UP BTC D.El.Ed 2nd Semester ( Paper 1 , 2 , 3 , 4 , 5 ,...","hardbook, Hindi, pawan",4.5,26,200,220,9
424,IAS COMBO Indian Economy By Ramsh Singh 10th Edition An...,"Paperback, RAMESH SINGH, MAJID HUSSAIN",4.2,441,508,1250,59
425,Objective Agriculture For JRF Exam,"Paperback, Dr. S. R. Kantwa",4.5,530,350,440,20
426,And Then There Were None,"English, Paperback, Christie Agatha",4.6,5378,132,250,47
427,"A Naturalist's Guide to the Trees & Shrubs of India, Pa...","English, Paperback, Sachdeva Pardeep",4.2,60,317,499,36
428,SSC English 2019 For General Competitions(Volume - 1),"Paperback, NEETU SINGH",4.4,1897,300,490,38
429,Skills in Mathematics - VECTORS & 3D GEOMETRY for JEE M...,"English, Paperback, Arihant Experts",4.6,1044,199,260,23
430,Self Study Package LLB Pravesh Pariksha 2020,"Hindi, Paperback, Arihant Experts",4.2,309,251,360,30
431,Comprehensive Guide to Ibps Bank Po/ Mt Preliminary & M...,"English, Paperback, unknown",4.4,377,489,820,40
432,Physics Galaxy 2020-21,"English, Paperback, Arora Ashish",4.7,361,463,760,39
433,Cbse All in One Hindi 'B' Class 10 for 2021 Exam,"Hindi, Paperback, Tiwari Manju",4.3,173,320,335,4
434,Sapiens,"Tamil, Paperback, Harari Yuval Noah",4.5,75,355,499,28
435,Ethics (Hindi) - Nitishastra with 1 Disc,"Hindi, Paperback, Sunil Agrahari",4.4,150,449,560,19
436,Themes in Indian History for Class - 12 (Set of 3 Parts...,"Paperback, NCERT",4.3,786,278,350,20
437,Ncert Biology Textbook For Class 11,"Paperback, NCERT",4.0,55,191,230,16
438,Instant Horticulture 17th Edition,"English, Paperback, S.N. Gupta",4.6,112,265,295,10
439,DC Dutta's Textbook of Obstetrics,"English, Paperback, Konar Hiralal",4.5,1319,1186,1295,8
440,A Naturalist's Guide To The Reptiles Of India,"English, Paperback, Das Indraneil",4.3,30,317,499,36
441,32 Years Neet-Aipmt Chapterwise Solutions - Chemistry 2...,"English, Paperback, unknown",4.5,2107,185,300,38
442,Reasoning & Aptitude for GATE & ESE- 2021,"MADE EASY Publications, MADE EASY Editorial Board",4.3,294,405,600,32
443,Normal People,"English, Paperback, Rooney Sally",4.5,160,427,699,38
444,Bharat Ka Prachin Itihas,"Fine Paperback, Hindi, Ram Sharan Sharma",4.1,99,234,299,21
445,Cbse All in One English Language & Literature Class 9 f...,"English, Paperback, Singh Gajendra",4.7,195,298,415,28
446,How to Win Friends and Influence People,"English, Paperback, Carnegie Dale",4.5,17036,159,199,20
447,Aristotle and Dante Discover the Secrets of the Univers...,"English, Paperback, Saenz Benjamin Alire",4.6,401,215,299,28
448,Play With Advanced Maths By Abhinay Sharma,"Paperback, Abhinay Sharma",4.4,2687,329,460,28
449,Learning How To Fly - Life Lessons for the Youth,"English, Paperback, Kalam Abdul A. P. J.",4.6,2503,145,195,25
450,"Adhunik Bharat Ka Itihas By Vipin Chandra, Indian Polit...","Paperback, Hindi, Bipin Chandra and M laxmikanth",4.3,607,638,979,34
451,Rapidex English For Hindi Speaking Course With CD,"PAPERBSCK, Hindi, R K GUPTA",4.3,155,245,250,2
452,Bihar Samanya Gyan,"Hindi, Crown Publication, Sudhir Lal",4.4,360,290,390,25
453,Nta UGC Paper 1 Teaching and Research Aptitude,"English, Paperback, Madaan K.V.S.",4.6,886,310,449,30
454,Set Of 3( Three )Classic Books,"Paperback, sapiens and stephens hawking",3.9,452,380,1228,69
455,SBI & IBPS Bank Clerk 44 Year-wise Solved Papers (2009-...,"English, Paperback, Disha Experts",4.3,83,440,710,38
456,Physics Part- I & II Class 11 NCERT,"Paperback, NCERT",4.3,303,215,270,20
457,My First Library - Boxset of 10 Board Books,"English, Hardcover, unknown",4.4,4427,474,750,36
458,Introduction to Electrodynamics 4/e PB 4 Edition,"English, Paperback, David G",4.6,1972,422,519,18
459,The Girl in Room 105,"English, Paperback, Bhagat Chetan",4.5,32067,113,199,43
460,IAS COMBO Indian Economy By Ramsh Singh 10th Edition An...,"Paperback, RAMESH SINGH, MAJID HUSSAIN",4.2,441,508,1250,59
461,Gate Ese Reasoning & Aptitude (2021),"Paperback, MADE EASY",4.4,29,445,600,25
462,Complete NEET Guide Chemistry,"English, Paperback, unknown",4.4,3000,498,775,35
463,Complete Neet Guide Chemistry,"English, Paperback, unknown",4.4,3000,506,775,34
464,"A Naturalist's Guide to the Trees & Shrubs of India, Pa...","English, Paperback, Sachdeva Pardeep",4.2,60,317,499,36
465,NCERT History Books Set Class 6 To 12 (English Medium -...,"Hardcover, NCERT",4.3,787,899,1250,28
466,IBPS Bank Clerk Guide for Preliminary & Main Exams 2020...,"Paperback, Disha Experts",4.6,53,449,690,34
467,Combo set of GeneraL Knowledge and objective general en...,"English, Paperback, Manohar Pandey, SP Bakshi",4.7,27,189,315,40
468,Fast Track Objective Arithmetic 2012,"English, Paperback, Verma Rajesh",4.2,634,285,465,38
469,Jawahar Navodaya Vidyalaya Entrance Exam 2020 Class 6,"English, Paperback, ARIHANT EXPERTS",4.4,916,200,315,36
470,Indian and World Geography For Civil Services Prelimina...,"English, Undefined, Husain Majid",4.4,230,444,575,22
471,Set Of 3 Book History Of Medieval India Prambhik Bharat...,"Paperback, Hindi, RAMSARAN SARMA, SATISH CHNDRA, BIPIN CHANDRA",4.2,1223,390,550,29
472,Objective Biology Chapter-wise MCQs for NTA NEET/ AIIMS...,"English, Paperback, Disha Experts",4.3,462,165,320,48
473,Ethics (Hindi) - Nitishastra with 1 Disc,"Hindi, Paperback, Sunil Agrahari",4.4,150,449,560,19
474,Bhagavad-Gita Yatharup (Hindi)(Hardcover),"Hardcover, Hindi, A. C. Bhaktivedanta Swami Prabhupada",4.6,594,180,350,48
475,Samanya Budhi Avum Tarkshakti Parikshan,"Hindi, Paperback, Jha R.K.",4.3,3032,110,155,29
476,14000 + Objective Questions - General Studies,"English, Paperback, Pandey Manohar",4.2,4058,450,899,49
477,Self Study Guide Neet - Bhautiki|Rasayan Vigyan|Jeev Vi...,"Hindi, Paperback, Garg S.N.",4.5,194,690,850,18
478,Ncert Exemplar Problems-Solutions Science Class 10th - ...,"English, Paperback, Experts",4.4,6128,98,125,21
479,A Naturalist's Guide To The Reptiles Of India,"English, Paperback, Das Indraneil",4.3,30,317,499,36
480,The Monk Who Sold His Ferrari,"Others, Paperback, Sharma Robin S.",4.8,8,157,185,15
481,D.Pharma 2nd Year In Bilingual (English & Hindi) 6 Book...,"HARD BOOK, Hindi, EXPERTS OF PANEL",4.6,22,1075,1300,17
482,T.S. Grewal's Double Entry Book Keeping: Accounting For...,"Paperback, TS GREWAL",4.4,245,845,1169,27
483,Bharat Ka Prachin Itihas,"Fine Paperback, Hindi, Ram Sharan Sharma",4.1,99,234,299,21
484,"Thermal Physics: With Kinetic Theory, Thermodynamics an...","English, Paperback, Garg S C",4.5,603,470,595,21
485,Think and Grow Rich,"English, Paperback, Hill Napoleon",4.5,32849,100,125,20
486,My First 1000 Words,"English, Hardcover, unknown",4.4,517,175,250,30
487,Complete NEET Guide PCB 3 BOOK COMBO SET,"Paperback, MTG",4.4,112,1485,2350,36
488,Unique Chalu Ghadamodi 55th Edition (1 Jan 2020 To 31 J...,"Paperback, Marathi, Deva Jadhavar",4.5,146,114,150,24
489,"Adhunik Bharat Ka Itihas By Vipin Chandra, Indian Polit...","Paperback, Hindi, Bipin Chandra and M laxmikanth",4.3,607,638,979,34
490,Ghai Essential Pediatrics - Ghai Essential Pediatrics,"English, Hardcover, Paul Vinod K.",4.6,597,867,1295,33
491,"English Ncert Class 11, English Textbook Class 11, Horn...","Paperback, NCERT",4.5,24,129,150,14
492,Set Of 3( Three )Classic Books,"Paperback, sapiens and stephens hawking",3.9,452,380,1228,69
493,Delhi Police Constable Bharti Pariksha Bilingual Solved...,"Paperback, Others, S.N. Prasad",4.3,148,163,175,6
494,Outline History Of English Literature,"English, Paperback, Hudson W H",4.3,543,88,125,29
495,Samanya Adhyayan (General Studies) & Samanya Vigyan (Ge...,"PAPERBOOK, Hindi, NEERAJ",4.3,80,246,370,33
496,Indian History avam National Moovment ( Bhartiy Etihas ...,"Hindi, Book, Drishti Publications",4.4,684,269,340,20
497,IAS COMBO Indian Economy By Ramsh Singh 10th Edition An...,"Paperback, RAMESH SINGH, MAJID HUSSAIN",4.2,441,508,1250,59
498,32 Years Neet-Aipmt Chapterwise Solutions - Biology 201...,"English, Paperback, unknown",4.5,2382,245,350,30
499,How to Win Friends and Influence People - The First and...,"English, Paperback, Carnegie Dale",4.5,17036,109,150,27
500,"A Naturalist's Guide to the Trees & Shrubs of India, Pa...","English, Paperback, Sachdeva Pardeep",4.2,60,317,499,36
501,Bhartiya Samvidhan Avam Rajyavyavastha (Quick Book),"Paperback, Hindi, Drishti Publications",4.4,250,257,280,8
502,Complete Mathematics for JEE Main 2021,"Paperback, Ravi Prakash, Ajay Kumar, Usha Gupta",4.9,27,875,995,12
503,Arihant Jee Main 3-Books Set (Ganeet + Rasayan + Bhauti...,"Paperback, Hindi, ARIHANT EXPEART TEAM",4.1,77,569,715,20
504,Computer Jaagrukta (Computer Awareness),"Hindi, Paperback, unknown",4.4,311,125,140,10
505,"Bhagavad Gita As It Is (English, Hardcover, A. C. Bhakt...","Hardcover, A C Bhaktivaibhava Swami Prabhupad",4.7,1807,230,455,49
506,Lok Vyavhar (Hindi Translation of How to Win Friends & ...,"Hindi, Paperback, Carnegie Dale",4.4,1016,107,150,28
507,MATHEMATICS FOR JEE MAIN,"English, Paperback, G TEWANI",4.5,823,750,965,22
